{
  "version": "1.0",
  "units": "meters",
  "north_vector": [0, 1],
  "site_boundary": {
    "layer": "site",
    "vertices": [
      [0, 0, 0],
      [60, 0, 0],
      [60, 40, 0],
      [0, 40, 0]
    ],
    "area": 2400
  },
  "buildings": [
    {
      "id": "ctx_north_01",
      "name": "Neighbor North",
      "layer": "context_buildings",
      "footprint": [
        [0, 38, 0],
        [60, 38, 0],
        [60, 42, 0],
        [0, 42, 0]
      ],
      "height": 35,
      "floors": 10,
      "footprint_area": 240,
      "bbox": {
        "min": [0, 38, 0],
        "max": [60, 42, 35]
      },
      "user_strings": {
        "type": "context",
        "source": "osm"
      }
    },
    {
      "id": "ctx_east_01",
      "name": "Neighbor East",
      "layer": "context_buildings",
      "footprint": [
        [58, 0, 0],
        [62, 0, 0],
        [62, 40, 0],
        [58, 40, 0]
      ],
      "height": 28,
      "floors": 8,
      "footprint_area": 160,
      "bbox": {
        "min": [58, 0, 0],
        "max": [62, 40, 28]
      }
    }
  ],
  "setbacks": [
    {
      "name": "required_setback",
      "layer": "setbacks",
      "vertices": [
        [3, 3, 0],
        [57, 3, 0],
        [57, 37, 0],
        [3, 37, 0]
      ]
    }
  ],
  "roads": [
    {
      "name": "Main Street",
      "layer": "roads",
      "width": 12,
      "centerline": [
        [30, -6, 0],
        [30, 0, 0]
      ]
    }
  ],
  "terrain": {
    "layer": "terrain",
    "sample_points": [
      [0, 0, 0],
      [30, 0, 0.5],
      [60, 0, 0.2],
      [0, 40, 0.1],
      [30, 40, 0.8],
      [60, 40, 0.3]
    ]
  },
  "zoning": {
    "max_height": 60,
    "far": 4.0,
    "max_coverage": 0.65,
    "notes": "Corner lot, south-facing frontage on Main Street."
  },
  "metadata": {
    "exported_from": "massing-explorer",
    "address": "Example Site, Demo City"
  }
}
